{
  "id": "numbers",
  "version": "1.0.0",
  "title": "Numbers",
  "scope": "An introductory exploration of why quantities need names and how numbers represent them.",
  "beginnerEntry": "No mathematical vocabulary is assumed; the learner can compare small collections of familiar objects.",
  "knowledge": {
    "conceptId": "numbers",
    "prerequisites": [],
    "relatedConcepts": ["counting", "quantity", "number-line"]
  },
  "learning": {
    "objectives": [
      "Explain that a number names a quantity.",
      "Predict which collection has more objects and justify the answer.",
      "Use a number to communicate a quantity to another person."
    ],
    "estimatedMinutes": 20,
    "steps": [
      { "kind": "observe", "prompt": "Look at a table with three apples and a table with five apples. What do you notice?" },
      { "kind": "wonder", "prompt": "How could you tell someone who cannot see the tables which table has more apples?" },
      { "kind": "predict", "prompt": "If two apples are added to the first table, predict whether the tables will have the same quantity." },
      { "kind": "explain", "prompt": "A number is a name for a quantity. Counting gives each object one number name so the final name communicates how many there are." },
      { "kind": "apply", "prompt": "Count four pencils, write the number that names the quantity, and explain how you know." }
    ]
  },
  "measurement": {
    "prePrompt": "Without counting aloud, explain how you would tell whether one small collection has more objects than another.",
    "postPrompt": "Explain what the number 4 communicates about a collection, then use it to compare four pencils with five pencils.",
    "successCriteria": [
      "The learner states that a number represents a quantity.",
      "The learner correctly compares the quantities.",
      "The learner gives a reason rather than only an answer."
    ]
  },
  "reasoning": {
    "misconceptions": [
      "A numeral is the collection itself rather than a symbol for its quantity.",
      "The final word in counting is unrelated to the total quantity."
    ],
    "tutorGuidance": "Ask the learner to match each counted object to one counting word, then ask what the final word lets them communicate about the whole collection. Do not introduce advanced notation before the learner can explain the quantity idea."
  },
  "provenance": {
    "source": "Sprint 1 Numbers vertical slice, derived under Academy Constitution SSOT v1.0.",
    "status": "draft"
  }
}
